66,The Unilever Series: Ai Weiwei ,Turbine Hall,Contemporary,China,Installation,Miniature / One Off,Ai Weiwei,2010-10-12,2011-05-02,202.0,2010-11-01 00:00:00,,Free,,,http://www.tate.org.uk/whats-on/tate-modern/exhibition/unilever-series/unilever-series-ai-weiwei-sunflower-seeds,"Ai Weiwei's Sunflower Seeds is made up of millions of small works, each apparently identical, but actually unique. However realistic they may seem, these life-sized sunflower seed husks are in fact intricately hand-crafted in porcelain. Each seed has been individually sculpted and painted by specialists working in small-scale workshops in the Chinese city of Jingdezhen. Far from being industrially produced, they are the effort of hundreds of skilled hands. Poured into the interior of the Turbine Hall’s vast industrial space, the 100 million seeds form a seemingly infinite landscape. Porcelain is almost synonymous with China and, to make this work, Ai Weiwei has manipulated traditional methods of crafting what has historically been one of China’s most prized exports. Sunflower Seeds invites us to look more closely at the ‘Made in China’ phenomenon and the geo-politics of cultural and economic exchange today.",,1153,1355,203
67,Gabriel Orozco ,,Contemporary,Mexico,Mixed,Artist,Gabriel Orozco ,2011-01-19,2011-04-25,96.0,2010-11-01 00:00:00,,Free,,,http://www.tate.org.uk/whats-on/tate-modern/exhibition/gabriel-orozco,"Creative, playful and inventive, Gabriel Orozco creates art in the streets, his apartment or wherever he is inspired. Born in Mexico but working across the globe, Orozco is renowned for his endless experimentation with found objects, which he subtly alters. His sculptures, often made of everyday things that have interested him, reveal new ways of looking at something familiar. A skull with a geometric pattern carefully drawn onto it, a classic Citroën DS car which the artist sliced into thirds, removing the central part to exaggerate its streamlined design, and a scroll filled with numbers cut out of a phone book are just some of his unique sculptures. Orozco’s photos are also on display, capturing the beauty of fleeting moments: water collecting in a punctured football, tins of cat food arranged on top of watermelons in a supermarket, or condensed breath disappearing from the surface of a piano show Orozco’s eye for simple but surprising and powerful images. His art also shows his fascination with game-playing, for example a billiard table with no pockets and a pendulum-like hanging ball, or Knights Running Endlessly, an extended chess board filled with an army of horses, both of which are well-known games to which he has added an element of futility. This kind of unexpected twist makes Orozco’s work interesting to both contemporary art lovers and also anyone who wants an unusual and captivating art experience.",,1252,1348,97
68,Restaurant Commission: James Aldridge ,Restaurant,Contemporary,UK,Painting,Miniature / One Off,James Aldridge,2007-08-16,2011-06-30,1414.0,2009-10-01 00:00:00,,Free,,,http://www.tate.org.uk/whats-on/tate-modern/exhibition/james-aldridge-cold-mouth-prayer,"Cold Mouth Prayer is a panoramic new painting, specially commissioned for Tate Modern’s Restaurant. Influenced by Renaissance landscape painting and nineteenth-century French scenic wallpaper, the artist explores his interest in the natural world as well as the ideas and imagery surrounding extreme heavy metal music. In this seductive landscape, crows exhale smoke in a scene rich in decorative flowers, yet loaded with sinister overtones.",,0,1414,1415
69,The Unilever Series: Dominique Gonzalez-Foerster ,Turbine Hall,Contemporary,France,Installation,Miniature / One Off,Dominique Gonzalez-Foerster,2008-10-14,2009-04-13,181.0,2009-10-01 00:00:00,,Free,,,http://www.tate.org.uk/whats-on/tate-modern/exhibition/unilever-series/unilever-series-dominique-gonzalez-foerster-th2058,"TH.2058 by Dominique Gonzalez-Foerster, imagines Tate Modern 50 years into the future, set in a London afflicted by perpetual rain. Tate Modern is being used as a shelter for people, a storage space for art works and for the remains of culture. The vast Turbine Hall is filled with monumental replicas of iconic sculptural works. Rows of bunk beds are scattered with books, and on a giant screen The Last Film is continuously running. Made up of short excerpts from science-fiction films, The Last Film suggests a potential state of catastrophe as well as the possibility of collective memory.",,425,606,182
70,UBS Openings: Paintings from the 1980s ,,Contemporary,Mixed,Painting,Theme,,2008-11-08,2009-04-13,156.0,2009-10-01 00:00:00,,Free,,,http://www.tate.org.uk/whats-on/tate-modern/exhibition/ubs-openings-paintings-1980s,"Towards the end of the 1970s, the dominance of conceptual art was challenged by a return to painting that was energetic and narrative. The moment was caught in an exhibition called A New Spirit in Painting. Looking back over more than twenty five years, this display recaptures that moment through exemplary works by a generation of artists from Italy, Germany, America and Britain. Taking the opportunity to combine paintings from The UBS Art Collection with significant Tate works, the display continues the sequence associated with the UBS and Tate partnership, opening up art to new audiences.",,450,606,157
71,Rodchenko & Popova: Defining Constructivism ,,Modernism,USSR,Mixed,Movement,,2009-02-12,2009-05-17,94.0,2009-10-01 00:00:00,,Free,,,http://www.tate.org.uk/whats-on/tate-modern/exhibition/rodchenko-popova,"This major exhibition explores the work and relationship of two of the Russian avant-garde's most important artists – Aleksandr Rodchenko (1891–1956) and Liubov Popova (1889–1924). The exhibition starts in 1917, the year of the October Revolution, and shows how the two artists shaped the future of Russian art. Rodchenko and Popova were the key figures of the Constructivist movement, rejecting the idea of 'art for art's sake' in favour of an art that participated in the revolution’s transformation of everyday life. With over 350 objects, the exhibition charts the evolution of these artists’ careers, from abstract painting to graphic design, including advertising posters, theatre sets, costume designs and books. Iconic works, such as posters for the classic film Battleship Potemkin directed by Sergei Eisenstein in 1925, are in the exhibition. Highlights also include the two artists’ breathtaking array of utopian abstract paintings produced between 1917 and 1921, featuring their trademark colourful geometric shapes. There are works from the groundbreaking 1921 exhibition 5x5=25, in which the artists collaborated with their colleagues Aleksandra Ekster, Aleksandr Vesnin and Varvara Stepanova to produce works including Rodchenko's famous monochromatic paintings Pure Red Colour, Pure Yellow Colour, and Pure Blue Colour. The exhibition shows how both artists had a huge influence on twentieth-century media and cinema, and includes films on which Rodchenko worked. There is also a reconstruction of Rodchenko’s famous Workers’ Club 1925, made for the International Exhibition of Modern Decorative and Industrial Arts in Paris to demonstrate the Soviet Union’s social equality and progressive modernity.",,546,640,95
72,Roni Horn aka Roni Horn,,Contemporary,USA,Mixed,Artist,Roni Horn,2009-02-25,2009-05-25,89.0,2009-10-01 00:00:00,,Free,,,http://www.tate.org.uk/whats-on/tate-modern/exhibition/roni-horn-aka-roni-horn,"Roni Horn is an American artist who has been making work since the 1970s. Horn worked through the legacy of minimalism yet developed her own concerns with memory and identity, and this is her first major museum show in the UK. Using a variety of materials including rubber, glass and gold, Horn’s work has an immense beauty and sensuality to it. Roni Horn You are the Weather 1994-95 photograph of a young woman's face The exhibition explores ideas that interest the artist about mutability and place. Her round, colourful cast-glass sculptures seem to have a liquid surface to them, and many of her photographs analyse the nature of water. Though based in New York, Horn is engaged with the landscape of Iceland, as a place which is constantly in a process of formation. In You are the Weather 1994–5, a set of 100 close-up photographs show a beautiful woman’s wet face with changing expressions, emerging from hot pools around Iceland. She also photographs the landscape and animals, the geysers and lava fields. Horn is interested in the idea of pairing and doubling. Many of her intricately constructed drawings feature paired clusters of cut-up lines. She often uses two identical photographs in a single work, breaking up the images to give the viewer a sense of déjà vu, such as in Dead Owl 1998, a pair of photographs of a stuffed snowy owl.",,559,648,90
73,Level 2 Gallery: Stutter ,Level 2,Contemporary,Mixed,Mixed,Theme,,2009-04-23,2009-08-16,115.0,2009-10-01 00:00:00,,Free,,,http://www.tate.org.uk/whats-on/tate-modern/exhibition/level-2-gallery-stutter,"The onomatopoeic word 'Stutter' refers to an act of speech interrupted by agitated, spasmodic, or involuntary repetitions. As the title for this exhibition, it suggests a metaphor for questions of disruption and discontinuity in processes of thought, systems of communications or conceptions of knowledge. The exhibition encompasses a wide range of artistic practices that incorporate repetition and interruption in order to convey meaning, whether through language, gesture, sound or images. In their highly methodical processes of work, Sven Augustijnen, Anna Barham, Dominique Petitgard, Michael Riedel and Will Stuart create a space for error, irrationality and transformation. Combining actions and strategies such as editing, quoting, translating, conversing, duplicating or indexing, these artists reveal a multiplicity of perspectives, directions and potentialities",,616,731,116
74,Robert Morris: Bodyspacemotionthings ,Turbine Hall,"Post-War, Contemporary",USA,Installation,Miniature / One Off,Robert Morris,2009-05-22,2009-06-14,23.0,2009-10-01 00:00:00,,Free,,,http://www.tate.org.uk/whats-on/tate-modern/exhibition/robert-morris-bodyspacemotionthings,"Climb, balance, crawl and roll on the interactive installation Bodymotionspacesthings by artist Robert Morris, as this series of huge props including beams, weights, platforms, rollers, tunnels and ramps built from materials such as plywood, stone, steel plate, and rope transforms the Turbine Hall. This is a re-creation of Tate Gallery’s first fully interactive exhibition which took place in 1971, inspiring a huge media and public interest, when an art gallery asked people for the first time to physically interact with an art work. Shockingly, it was closed just four days after opening, due to the unexpected and over enthusiastic response of the audience. This time around, it will be created using contemporary materials based upon the original plans, in collaboration with Morris, enabling you to experience an exciting landmark in Tate's history. Bodymotionspacesthings was installed at Tate Modern as part of UBS Openings: The Long Weekend 2009. Following the success of this, opening has been extended to 14 June 2009. Robert Morris (Born in Kansas City in 1931. Lives and works in New York State.) Morris was collaboratively involved with the Judson Dance Theater in the early 1960s, choreographing a number of important works. This experience was influential in his development as a pioneer of minimalist sculpture and process art, as he explored the viewer's perception and experience of object and space. He has since continued a prolific practice as artist and writer, producing performance, painting, drawing, installation and sculpture. He is the author of a series of seminal critical essays, including Notes on Sculpture (1966), often exploring ideas addressed in his artworks. Major exhibitions of his work include his installation at the Green Gallery, New York (1965), as well as solo shows at the Whitney Museum (1970), the Tate Gallery (1971) and the Guggenheim, New York (The Mind/Body Problem 1994). Recently, his work has been exhibited at Leo Castelli, New York (Robert Morris: Deflationary Objects, 1962–1976 2008), Sprüth Magers Lee, London (Robert Morris: Early Sculpture 2005 and Morning Star Evening Star 2008).",,645,668,24
75,Futurism,,Modernism,Italy,Sculpture,Movement,,2009-06-12,2009-09-20,100.0,2009-10-01 00:00:00,,Free,,,http://www.tate.org.uk/whats-on/tate-modern/exhibition/futurism,"Futurism was an art movement launched by the Italian poet Filippo Tommaso Marinetti in 1909. On 20 February he published his Manifesto of Futurism on the front page of the Paris newspaper Le Figaro. That moment saw the birth of the Futurists, a small group of radical Italian artists working just before the outbreak of the First World War. Among modernist movements, the Futurists rejected anything old and looked towards a new Italy. This was partly because the weight of past culture in Italy was felt as particularly oppressive. In his Manifesto, Marinetti asserted 'we will free Italy from her innumerable museums which cover her like countless cemeteries.'Welcome to EditPad.org - your online plain text editor. Enter or paste your text here. To download and save it, click on the button below. What the Futurists proposed instead was an art that celebrated the modern world of industry and technology: 'We declare … a new beauty, the beauty of speed. A racing motor car … is more beautiful than the Victory of Samothrace' (the celebrated ancient Greek sculpture in the Louvre museum in Paris). From an original blend of elements of Neo-Impressionism and Cubism, the Futurists created a new style that expressed the idea of the dynamism, energy and movement of modern life. The chief artists were Giacomo Balla, Umberto Boccioni, Carlo Carrà, Gino Severini and Luigi Russolo. Tate Modern celebrates the centenary of this dramatic art movement with a ground-breaking exhibition. Here you'll see the work of the Futurists accompanied by rooms looking at art movements reacting to Futurism, including Cubism, the British art movement Vorticism, and Russian Cubo-Futurism. Highlights include Boccioni's dynamic bronze sculpture of a man which seems to leap through thin air, Picasso's Head of a Woman, Nevinson's Vorticist masterpiece Bursting Shell, and works by major artists such as Braque, Leger, Malevich, and Duchamp.",,666,766,101
76,Per Kirkeby,,Contemporary,Denmark,Painting,Artist,Per Kirkeby,2009-06-17,2009-09-06,81.0,2009-10-01 00:00:00,,Free,,,http://www.tate.org.uk/whats-on/tate-modern/exhibition/kirkeby,"Per Kirkeby is a household name in his native Denmark, and remains one of their best known contemporary artists. His lush, huge paintings, full of colour and movement, draw you into his mystical surroundings and abstract world. In the mid-1980s, Per Kirkeby rose to prominence alongside artists such as Georg Baselitz and Sigmar Polke, who were pioneering the rise of new painting. However Kirkeby's work defies categories by mixing high art and popular culture with the natural scenery, keeping strong roots in the artistic and cultural traditions of Denmark. One of his conceptual themes is to examine the Danish tradition of Huts in all manner of sizes, styles and shapes. Kirkeby is inspired by 'pop' art, comics and fairytales, playing on the Danish stereotype of the hut in the wilderness by creating a comic-like impression of a hut, complete with kitsch motifs of trees and rising suns. Kirkeby demonstrates a keen interest in history and art history in his works, with a career including stints as a sculptor, architect, printmaker, draughtsman, filmmaker and writer. The Siege of Constantinople 1995 (which pays homage to the original by Delacroix) is a monumental painting with  grand historical reference, huge exuberance and visual intensity. Soft Lapping of Waves,Green 2005, a more recent painting, shows his ability to build up a rich surface with textures, effects and multiple layers. This exhibition also includes the artist's bronze sculptures, 'blackboard' paintings, watercolours, books, and previously unseen 'pop'-inspired paintings of the 1960s.",,671,752,82
77,Jill Magid,Level 2,Contemporary,USA,Installation,Miniature / One Off,Jill Magid,2009-09-10,2010-01-03,115.0,2009-10-01 00:00:00,,Free,,,http://www.tate.org.uk/whats-on/tate-modern/exhibition/level-2-gallery-jill-magid,"American artist Jill Magid's work is deeply ingrained in her lived experience, exploring and blurring the boundaries between art and life. Through her performance-based practice, Magid seeks intimate relations with structures of authority, the resulting narratives often taking the form of a love story. Authority to Remove, a one-off installation at Tate Modern, offers the viewer a unique opportunity to experience the final chapter of an epic tale, details of which were secured behind glass at the time of going to print. Authority to Remove marks the final chapter of American artist Jill Magid's long involvement with the Dutch secret service, the AIVD. In 2005, she was commissioned by the AIVD (De Algemene Inlichtingen en Veiligheidsdienst) to create an artwork for their new headquarters. This unlikely seeming invitation came about as the result of a stipulation under Dutch law that a portion of the budget for the new building be spent on an art commission. Through her performance-based practice, Magid has initiated intimate relations with a number of organisations and structures of authority. She explores the emotional, philosophical and legal tensions between the individual and 'protective' institutions, such as intelligence agencies or the police. To work alongside or within large organisations, Magid makes use of institutional quirks, systemic loopholes that allow her to make contact with people 'on the inside'. Her work tends to be characterised by the dynamics of seduction, the resulting narratives often taking the form of a love story. It is typical of Magid's practice that she follows the rules of engagement with an institution to the letter – sometimes to the point of absurdity.",,756,871,116
78,Pop Life: Art in a Material World,,Contemporary,Mixed,Mixed,Movement,,2009-10-01,2010-01-17,108.0,2009-10-01 00:00:00,,Free,,,http://www.tate.org.uk/whats-on/tate-modern/exhibition/pop-life-art-material-world,"‘Good business is the best art,’ Andy Warhol once provocatively claimed. Tate Modern's hit autumn exhibition Pop Life examines how artists since the 1980s have cultivated their public persona as a product, and conjured a dazzling mix of media, commerce and glamour to build their own 'brands'. Beginning with the grandfather of Pop, Andy Warhol, the show includes Jeff Koons's infamous Made in Heaven series and his stainless steel Rabbit sculpture, an iconic array of golden spot and butterfly paintings from Damien Hirst's record-breaking 2008 auction, and a reconstruction of Keith Haring's Pop Shop in New York. Also included will be works by Richard Prince, Martin Kippenberger, and the notorious YBAs, and a new commission by Takashi Murakami.",,777,885,109
79,John Baldessari,,"Post-War, Contemporary",USA,Mixed,Artist,John Baldessari,2009-10-13,2010-01-10,89.0,2009-10-01 00:00:00,,Free,,,http://www.tate.org.uk/whats-on/tate-modern/exhibition/john-baldessari-pure-beauty,"Based in Los Angeles since the 1960s, John Baldessari (born 1931) is one of the most influential artists of his generation. Making his name as a pioneer of conceptual art in the 1960s with his text and image paintings, he shocked the art world when he announced in a newspaper that he was cremating all the artworks he had produced between 1953 and 1966. He then turned his attention to photographic works often incorporating found film stills, trawling dumpsters for discarded material from which he created his famous photo-compositions. Baldessari's lifelong interest in language, both written and visual, has been at the forefront of both his artwork and his teaching, through which, over more than thirty years, he has nurtured and influenced succeeding generations of artists. His work has had a huge influence on Cindy Sherman, David Salle, and Barbara Kruger among others. His works incorporate wit and irony, both mocking conceptual art and delivering it in his iconic work I Am Making Art; superimposing media images and painting with his trademark dots and over-painted figures in The Duress Series; and exploring the idea of subliminal images in advertising in his sequence of ice cubes containing the words of his name, 'U-BUY BAL DES SARI'.",,789,878,90
80,The Unilever Series: Doris Salcedo,Turbine Hall,Contemporary,Colombia,Installation,Miniature / One Off,Doris Salcedo,2007-10-09,2008-04-06,180.0,2008-09-01 00:00:00,,Free,,,http://www.tate.org.uk/whats-on/tate-modern/exhibition/unilever-series/unilever-series-doris-salcedo-shibboleth,"Doris Salcedo’s Shibboleth is the first work to intervene directly in the fabric of the Turbine Hall. Rather than fill this iconic space with a conventional sculpture or installation, Salcedo has created a subterranean chasm that stretches the length of the Turbine Hall. The concrete walls of the crevice are ruptured by a steel mesh fence, creating a tension between these elements that resist yet depend on one another. By making the floor the principal focus of her project, Salcedo dramatically shifts our perception of the Turbine Hall’s architecture, subtly subverting its claims to monumentality and grandeur. Shibboleth asks questions about the interaction of sculpture and space, about architecture and the values it enshrines, and about the shaky ideological foundations on which Western notions of modernity are built. In particular, Salcedo is addressing a long legacy of racism and colonialism that underlies the modern world. A ‘shibboleth’ is a custom, phrase or use of language that acts as a test of belonging to a particular social group or class. By definition, it is used to exclude those deemed unsuitable to join this group. ‘The history of racism’, Salcedo writes, ‘runs parallel to the history of modernity, and is its untold dark side’. For hundreds of years, Western ideas of progress and prosperity have been underpinned by colonial exploitation and the withdrawal of basic rights from others. Our own time, Salcedo is keen to remind us, remains defined by the existence of a huge socially excluded underclass, in Western as well as post-colonial societies. In breaking open the floor of the museum, Salcedo is exposing a fracture in modernity itself. Her work encourages us to confront uncomfortable truths about our history and about ourselves with absolute candidness, and without self-deception.",,54,234,181
81,Juan Muñoz A Retrospective,,Contemporary,Spain,Sculpture,Artist,Juan Munoz,2008-01-24,2008-04-27,94.0,2008-09-01 00:00:00,,Free,,,http://www.tate.org.uk/whats-on/tate-modern/exhibition/juan-munoz-retrospective,"Spanish artist Juan Muñoz (1953–2001) came to international prominence in the mid 1980s with dramatic sculptural installations that placed the human figure in specific architectural environments. His reputation was built on his power to create an intriguing tension between the illusory and the real, the contrasting acts of looking and receiving, and the poignant isolation of the individual amongst a crowd. This exhibition includes well-known sculptures such as Many Times 1999, The Prompter 1988 and Conversation Piece 1996, the ‘raincoat drawings’, and important pieces with sound, light and mechanical elements. This is the first major solo retrospective of Juan Muñoz in the UK since Double Bind 2001, his remarkable installation for the Turbine Hall, the second in the Unilever Series at Tate Modern. Several performances took place during the exhibition, which are the result of Muñoz’s collaborations with well-known composers, writers and filmmakers.",,161,255,95
