ID,Exhibition,Space,Era,Country,Medium,Type of Exhibition,Principal Artist,Start Day,End Day,Duration,Report Year,Visitors,Charge?,Co-Organisers,Sponsors,Link,Description,A review with more info,days_to_start,days_to_end,exhib_duration
1,Mona Hatoum,,Contemporary,"Lebanon, UK",Sculpture,Artist,Mona Hatoum,2016-05-04,2016-08-21,109.0,2016-17,,Paid,"Centre Pompidou, Musée National d’Art Moderne, Paris, in collaboration with Tate Modern and Finnish National Gallery / the Museum of Contemporary Art Kiasma, Helsinki",AGC Equity Partners with additional support from Jabre Capital Partners SA Geneva,http://www.tate.org.uk/whats-on/tate-modern/exhibition/mona-hatoum,"Born in Beirut to a Palestinian family, Mona Hatoum settled in England in 1975. Her work creates a challenging vision of our world, exposing its contradictions and complexities, often making the familiar uncanny. Through the juxtaposition of opposites such as beauty and horror, she engages us in conflicting emotions of desire and revulsion, fear and fascination.",,3184,3293,110
2,Georgia O’Keeffe,,Modernism,USA,Painting,Artist,Georgia O’Keeffe,2016-07-06,2016-10-30,116.0,2016-17,,Paid,-,Art Mentor Foundation Lucerne with additional support from the Georgia O’Keeffe Exhibition Supporters Group and Tate Patrons,http://www.tate.org.uk/whats-on/tate-modern/exhibition/georgia-okeeffe,"Georgia O’Keeffe is best known for her paintings of magnified flowers, animal skulls, and New Mexico desert landscapes. This exhibition brings together some of her most important works, including Jimson Weed/White Flower No. 1 1932, the most expensive painting by a female artist ever sold at auction. Making her debut a century ago, in 1916, O’Keeffe was immediately recognised as a trailblazing artist, while today her legacy as an American art icon and a pioneer of twentieth-century art is widely recognised. With no works by O’Keeffe in UK public collections this exhibition is a rare chance to see the beauty and skill of her remarkable paintings outside the US",,3247,3363,117
3,Bhupen Khakhar: You Can’t Please All,,Post-War,India,Painting,Artist,Bhupen Khakhar,2016-06-01,2016-11-06,158.0,2016-17,,Paid,-,Deutsche Bank. Supported by Kiran Nadar Museum of Art with additional support from the Bhupen Khakhar Exhibition Supporters Circle,http://www.tate.org.uk/whats-on/tate-modern/exhibition/bhupen-khakhar,"Renowned for his unique figurative style and incisive observations of class and sexuality, Bhupen Khakhar (1934-2003) played a central role in modern Indian art and was a key international figure in 20th century painting. This landmark exhibition showcases vivid works on canvas, luminous watercolour paintings and experimental ceramics.  An accountant-turned-artist, Bhupen Khakhar demonstrated a commitment to representing his world with unflinching honesty. High and low merged in narrative paintings with influences ranging from devotional aesthetics and street culture to European painting and pop art. He confronted provocative themes, particularly his sexuality, with rare sensitivity and wit. Haunting portraits of ordinary men and last works describing his struggle with cancer express a rare humanity.   Bringing together Khakhar’s work from across five decades and collections around the world for the first time since his death, this is a unique opportunity to discover his extraordinary work and inspirational story.",,3212,3370,159
4,Anne Teresa de Keersmaeker: Work / Travail / Arbeid,Turbine Hall,Contemporary,Belgium,Performance,Performance,Anne Teresa de Keersmaeker:,2016-07-08,2016-07-10,2.0,2016-17,,Free,-," Rosas, Ictus, WIELS, with support of the BNP Paribas Foundation. Work/Travail/Arbeid was initiated by WIELS Contemporary Art Centre and Rosas and has been made possible with the support of De Munt/La Monnaie, BOZAR - Centre for Fine Arts, Kaaitheater, Kunstenfestivaldesarts, Ictus, BNP Paribas Fortis, BNP Paribas Foundation, WIELS Patrons and Rolex Institute. ",http://www.tate.org.uk/whats-on/tate-modern/exhibition/anne-teresa-de-keersmaeker,"What would it mean for choreography to perform as an exhibition? This question forms the starting point for Anne Teresa De Keersmaeker’s latest ground-breaking work Work/Travail/Arbeid. De Keersmaeker first performed at Tate Modern during the opening of the Tanks in 2012. For this new work, she has transferred her dance performance Vortex Temporum 2013, choreographed to music by composer Gérard Grisey, from the theatre stage to the more open setting of a museum. The exhibition was originally presented at WEILS Centre for Contemporary Art, Brussels, and its intricate intertwining of sound and movement has been reimagined for the unique space of Tate Modern’s Turbine Hall. The work questions the convention that choreography can only be presented on stage and celebrates dance as a rigorous, structured medium.",,3249,3251,3
5,The EY Exhibition: Wifredo Lam,,Modernism,Cuba,Painting,Artist,Wilfredo Lam,2016-09-14,2017-01-08,116.0,2016-17,,Paid,"Centre Pompidou, Musée national d’art moderne, Paris, in collaboration with Tate Modern, London, and the Museo Nacional Centro de Arte Reina Sofia, Madrid",EY Tate Arts Partnership,http://www.tate.org.uk/whats-on/tate-modern/exhibition/wifredo-lam,"Wifredo Lam’s distinctive style shook the assumptions of western Modernism. His distinctive paintings introduced the symbolism of his Cuban roots and defined a new way of painting for a post-colonial world. As he travelled in Europe and North and South America, he was a witness to twentieth century political upheaval – including the Spanish Civil War, the evacuation of artists and intellectuals from France with the onset of World War II, and the new Cuba borne of the Revolution. Born in Cuba in 1902, Lam’s mother was of Spanish and African heritage, and his father was Cantonese Chinese. After eighteen years in Europe, Lam returned to Cuba and rediscovered the local African traditions that transformed his work. Closely connected to movements such as Cubism and Surrealism and artists and writers such as Pablo Picasso, André Breton, Asger Jorn, Lucio Fontana and Aimé Césaire, his unique work spans continents and traditions. Throughout his long career, his work addressed themes of social injustice, nature and spirituality, that challenged prevailing attitudes held by western artists about other cultures. His work continues to bring a historical perspective to contemporary issues. This exhibition celebrates Lam’s life and work and confirms his place at the centre of global art history.",,3317,3433,117
6,Robert Rauschenberg,,Post-War,USA,Mixed,Artist,Robert Rauschenberg,2016-12-01,2017-04-02,122.0,2016-17,,Paid,"The Museum of Modern Art, New York","Bank of America Merrill Lynch. Supporting Sponsor: Tiffany & Co. Supported by Terra Foundation for American Art and Art Mentor Foundation Lucerne with additional support from the Robert Rauschenberg Exhibition Supporters Group, Tate Americas Foundation and Tate Patrons",http://www.tate.org.uk/whats-on/tate-modern/exhibition/robert-rauschenberg,"Robert Rauschenberg blazed a new trail for art in the second half of the twentieth century. This landmark exhibition celebrates his extraordinary six-decade career, taking you on a dazzling adventure through modern art in the company of a truly remarkable artist. From paintings including flashing lights to a stuffed angora goat, Rauschenberg’s appetite for incorporating things he found in the streets of New York knew no limits. Pop art silkscreen paintings of Kennedy sit alongside 1000 gallons of bentonite mud bubbling to its own rhythm. Rauschenberg even made a drawing which was sent to the moon. Each room captures a different moment of this rich journey, from Rauschenberg’s early response to abstract expressionism to his final works saturated in images and colour. Seen together they show how Rauschenberg rethought the possibilities for art in our time. This exhibition, organised in collaboration with The Museum of Modern Art, New York, is the first full-scale retrospective since the artist’s death in 2008 and the ultimate Rauschenberg experience. It is your one chance to see these major international loans together in one place, while discovering the full story of an inspirational and much-loved artist whose influence is still felt today.",,3395,3517,123
7,The Radical Eye: Modernist Photography from the Sir Elton John Collection,,Modernism,Mixed,Photography,Collection,-,2016-11-10,2017-05-21,192.0,2016-17,,Paid,-,-,http://www.tate.org.uk/whats-on/tate-modern/exhibition/radical-eye-modernist-photography-sir-elton-john-collection,"This is a once-in-a-lifetime chance to see one of the world’s greatest private collections of photography, drawn from the classic modernist period of the 1920s–50s. An incredible group of Man Ray portraits are exhibited together for the first time, having been brought together by Sir Elton John over the past twenty-five years, including portraits of Matisse, Picasso, and Breton. With over 70 artists and nearly 150 rare vintage prints on show from seminal figures including Brassai, Imogen Cunningham, André Kertész, Dorothea Lange, Tina Modotti, and Aleksandr Rodchenko, this is a chance to take a peek inside Elton John’s home and delight in seeing such masterpieces of photography.",,3374,3566,193
8,Hyundai Commission: Philippe Parreno – Anywhen,Turbine Hall,Contemporary,France,Installation,Miniature / One off,Philippe Parreno,2016-10-04,2017-04-02,180.0,2016-17,,Free,,"Hyundai Motor. With support from Kvadrat, LUMA Foundation and the Philippe Parreno Supporters Circle",http://www.tate.org.uk/whats-on/tate-modern/exhibition/hyundai-commission/philippe-parreno-anywhen,"Prepare to have your senses activated and stimulated by a spectacular choreography of acoustics, sound lighting, flying objects and film, each connected to the other and playing their part in a far bigger score. Tate’s Turbine Hall becomes a universe of inter-related and connected events and parallel realities. Events will unfold anywhen.  Anywhen is a site-specific exhibition that changes throughout the day and that will evolve during the six-month period of the commission. The exhibition is conceived as an automaton which guides the public through a constantly changing play of moving elements, light configurations and sound environments. The artist states that ‘the exhibition is a construction of situations or sequences in a non-linear narrative’. The commission responds to the Turbine Hall’s position at the centre of the museum, an open space connected to the city itself. The artist combines aspects of chance and control: the sequences of events are triggered by software which is informed by micro-organisms. These react to and activate elements of the commission through a bioreactor visible at the far end of the Turbine Hal",,3337,3517,181
9,BMW Tate Live Exhibition: Ten Days Six Nights,The Tanks,Contemporary,Mixed,Mixed,Mixed,-,2017-03-24,2017-04-02,9.0,2016-17,,Both,,BMW,http://www.tate.org.uk/whats-on/tate-modern/exhibition/bmw-tate-live-exhibition-ten-days-six-nights,"Situated in the Tanks, the first BMW Tate Live Exhibition brings together an intergenerational selection of artists that have been invited to stage their work as a space that extends a form of hospitality or community, to other artists and visitors alike. The artists create images of networks and forms of participation that link natural environment with social media, organic and technological, human and non-human. Isabel Lewis is in residence throughout the duration of the exhibition hosting a number of her signature occasions, combining music, food, drink and perfume to create an alternative environment for dance, discussions and invited musicians. CAMP, a collaborative studio founded in Mumbai in 2007, use the Transformer Galleries and the East Tank as a space to share Could Have Beens, a selection of rarely-seen installations each reworking systems of electricity and imaging to propose alternate socio-tecnological scenarios. Wu Tsang and Fred Moten present Gravitational Feel, a sculptural performance using fabric and sound to explore the social and physical significance of touch and voice. Installations by Carlos Casas, Phill Niblock, and Lorenzo Senni exist as site-specific environments open to the public by day. Fujiko Nakaya will transform the South Terrace for the first time with an immersive fog sculpture, animated by a light and soundscape made in collaboration with Nakaya’s historic collaborators: Ryuichi Sakamoto and Shiro Takatani; and host performances by renowned dancer and choreographer Min Tanaka.",,3508,3517,10
10,Wolfgang Tillmans: 2017,,Contemporary,Belgium,Mixed,Artist,Wolfgang Tillmans,2017-02-15,2017-06-11,116.0,2016-17,,Paid,,Hyundai Cars. With additional support from Tate International Council and Tate Patrons.,http://www.tate.org.uk/whats-on/tate-modern/exhibition/wolfgang-tillmans-2017,"What are we to make of the world in which we find ourselves today?  Contemporary artist Wolfgang Tillmans offers plenty of food for thought. This is Wolfgang Tillmans’s first ever exhibition at Tate Modern and brings together works in an exciting variety of media – photographs, of course, but also video, digital slide projections, publications, curatorial projects and recorded music – all staged by the artist in characteristically innovative style. The year 2003 is the exhibition’s point of departure, representing for Tillmans the moment the world changed, with the invasion of Iraq and anti-war demonstrations. The social and political form a rich vein throughout the artist’s work.  German-born, international in outlook and exhibited around the world, Tillmans spent many years in the UK and is currently based in Berlin. In 2000, he was the first photographer and first non-British artist to receive the Turner Prize.",,3471,3587,117
11,The Ey Exhibition: Sonia Delaunay,The Eyal Ofer Galleries,Modernism,France,Painting,Artist,Sonia Delaunay,2015-04-15,2015-08-09,116.0,2015-16,,Free,,EY Tate Arts Partnership. Supported by the Huo Family Foundation (UK),http://www.tate.org.uk/whats-on/tate-modern/exhibition/sonia-delaunay,"Sonia Delaunay (1885–1979) was a key figure in the Parisian avant-garde and became the European doyenne of abstract art. Throughout the first half of the twentieth century, she celebrated the modern world of movement, technology and urban life, exploring new ideas about colour theory together with her husband Robert Delaunay. This is the first UK retrospective to assess the breadth of her vibrant artistic practice across a wide range of media. It features the groundbreaking paintings, textiles and clothes she made across a sixty-year career, as well as the results of her innovative collaborations with poets, choreographers and manufacturers, from Diaghilev to Liberty.",,2799,2915,117
12,Agnes Martin,,Post-War,USA,Painting,Artist,Agnes Martin,2015-06-03,2015-10-11,130.0,2015-16,,Free,,"The Henry Luce Foundation and Terra Foundation for American Art. With additional support from the Artworkers Retirement Society, the Agnes Martin Exhibition Supporters Group and Tate International Council",http://www.tate.org.uk/whats-on/tate-modern/exhibition/agnes-martin,"Agnes Martin is perhaps most recognised for her evocative paintings marked out in subtle pencil lines and pale colour washes. Although restrained, her style was underpinned by her deep conviction in the emotive and expressive power of art. Martin believed that spiritual inspiration and not intellect created great work. ‘Without awareness of beauty, innocence and happiness’ Martin wrote ‘one cannot make works of art’. Martin lived and worked in New York, becoming a key figure in the male-dominated fields of 1950s and 1960s abstraction. Then in 1967, just as her art was gaining acclaim, Martin abandoned the city and went in search of solitude and silence. For almost two years she travelled across the US and Canada before finally settling in New Mexico as Georgia O’Keeffe, Mark Rothko, DH Lawrence and Edward Hopper had done before her. Working within tightly prescribed limits she imposed on her own practice Martin was able to continue to make extraordinary, visionary paintings, for over three decades until her death in 2004. This is the first retrospective of Martin’s work since 1994. Covering the full breadth of her practice, this extensive exhibition will reveal Martin’s early and little known experiments with different media and trace her development from biomorphic abstraction to the mesmerising grid and striped canvases that became her hallmark.",,2848,2978,131
13,Hyundai Commission 2015: Abraham Cruzvillegas: Empty Lot,Tubrine Hall,Contemporary,Mexico,Installation,Miniature / One off,Abraham Cruzvillegas,2015-10-13,2016-04-03,173.0,2015-16,,Free,,"Hyundai Motor and Tate Modern, Terra Foundation for American Art. With additional support from the Performing Sculpture Supporters Circle, Tate International Council and Tate Patrons",http://www.tate.org.uk/whats-on/tate-modern/exhibition/hyundai-commission-2015-abraham-cruzvillegas-empty-lot,"Empty Lot is a large geometric sculpture created using scaffolding, a grid of triangular wooden planters, and soil collected from parks across London including Peckham, Haringey and Westminster. Nothing will be planted in the soil, but it will be lit by lamps and watered throughout the six month display. The unpredictable nature of the work, which may grow and change from one week to the next, provokes questions about the city and nature, as well as wider ideas of chance, change, and hope.",,2980,3153,174
14,Alexander Calder: Performing Sculpture,,Post-War,USA,Sculpture,Artist,Alexander Calder,2015-11-11,2016-04-03,144.0,2015-16,,Free,,EY Tate Arts Partnership Supported by The World Goes Pop Exhibition Supporters Group and Tate International Council,http://www.tate.org.uk/whats-on/tate-modern/exhibition/alexander-calder-performing-sculpture,"Calder travelled to Paris in the 1920s, having originally trained as an engineer, and by 1931 he had invented the mobile, a term coined by Duchamp to describe Calder’s sculptures which moved of their own accord. Alexander Calder Antennae with Red and Blue Dots c1953 Tate © 2015 Calder Foundation, New York / DACS London. His dynamic works brought to life the avant-garde’s fascination with movement, and brought sculpture into the fourth dimension. Continuing Tate Modern’s acclaimed reassessments of key figures in modernism, Alexander Calder: Performing Sculpture will reveal how motion, performance and theatricality underpinned his practice. It will bring together major works from museums around the world, as well as showcasing his collaborative projects in the fields of film, theatre, music and dance.",,3009,3153,145
15,The Ey Exhibition: The World Goes Pop,The Eyal Ofer Galleries,Post-War,Mixed,Mixed,Movement,- ,2015-09-17,2016-01-24,129.0,2015-16,,Paid,,Hyundai Card. With additional support from Tate International Council and Tate Patrons,http://www.tate.org.uk/whats-on/tate-modern/exhibition/world-goes-pop,"Tate Modern is ready to tell a global story of pop art, breaking new ground along the way, and revealing a different side to the artistic and cultural phenomenon. From Latin America to Asia, and from Europe to the Middle East, this explosive exhibition connects the dots between art produced around the world during the 1960s and 1970s, showing how different cultures and countries responded to the movement. Politics, the body, domestic revolution, consumption, public protest, and folk – all will be explored and laid bare in eye-popping Technicolor and across many media, from canvas to car bonnets and pinball machines. The exhibition will reveal how pop was never just a celebration of western consumer culture, but was often a subversive international language of protest – a language that is more relevant today than ever.",,2954,3083,130
16,Performing For The Camera,The Eyal Ofer Galleries,Mixed,Mixed,Photography,Theme,- ,2016-02-18,2016-06-12,115.0,2015-16,,Paid,,-,http://www.tate.org.uk/whats-on/tate-modern/exhibition/performing-camera,"Photography has been used to capture performances since its invention – from the stars of the Victorian stage to the art happenings of the 1960s, right up to today’s trend for selfies. This exhibition explores the relationship between the two forms, looking at how performance artists use photography and how photography is in itself a performances. Performing for the Camera includes over 500 images, including vintage prints, large scale works, marketing posters and Instagrammed photos. It shows how photographs have captured performances by important artists including Yves Klein and Yayoi Kusama, and ground-breaking collaborations between photographers, performers and dancers. It looks at how artists including Francesca Woodman, Erwin Wurm and others have used photography as a stage on which to perform, and how figures from Cindy Sherman and Hannah Wilke to Marcel Duchamp and Samuel Fosso have used photography to explore identity",,3108,3223,116
17,Henri Matisse: The Cut-Outs,,Modernism,France,Sculpture,Artist,Henri Matisse,2014-04-17,2014-09-07,143.0,2014-15,562622,Paid, New York at the Museum of Modern Art ,Bank of America Merrill Lynch. With additional sponsorship from Hanjin Shipping. Supported by Henri Matisse Exhibition Supporters Group and Tate Patrons ,http://www.tate.org.uk/whats-on/tate-modern/exhibition/henri-matisse-cut-outs,"Henri Matisse is a giant of modern art. This landmark show explores the final chapter in his career in which he began ‘carving into colour’ and his series of spectacular cut-outs was born.The exhibition represents a once-in-a-lifetime chance to see so many of the artist’s works in one place and discover Matisse’s final artistic triumph. In his late sixties, when ill health first prevented Matisse from painting, he began to cut into painted paper with scissors to make drafts for a number of commissions. In time, Matisse chose cut-outs over painting: he had invented a new medium. From snowflowers to dancers, circus scenes and a famous snail, the exhibition showcases a dazzling array of 120 works made between 1936 and 1954. Bold, exuberant and often large in scale, the cut-outs have an engaging simplicity coupled with incredible creative sophistication. The exhibition marks an historic moment, when treasures from around the world can be seen together. Tate’s The Snail 1953 is shown alongside its sister work Memory of Oceania 1953 and Large Composition with Masks 1953 at 10 metres long. A photograph of Matisse’s studio reveals that these works were initially conceived as a unified whole, and this is the first time they will have been together in over 50 years. The exhibition also places side by side the largest number of Matisse’s famous Blue Nudes ever exhibited together. London is first to host, before the exhibition travels to New York at the Museum of Modern Art and after which the works return to galleries and private owners around the world.",,2436,2579,144
18,Project Space: A Chronicle of Interventions,Project Space,Mixed,Mixed,Mixed,Theme,-,2014-05-02,2014-07-13,72.0,2014-15,,Free,"TEOR/éTica, San José, Costa Rica,","Catherine Petitgas, Tate International Council, Tate Patrons and Tate Americas Foundation",http://www.tate.org.uk/whats-on/tate-modern/exhibitionseries/project-space/project-space-chronicle-interventions,"A Chronicle of Interventions explores the multiple histories of intervention that have occurred throughout Central America during the 20th century and displays the work of seven practicing artists who each explore various foreign, economic, political and military interventions which have shaped the region. Harking back to 1980s New York, the exhibition begins with an archival display of the seminal installation by Group Material, entitled Timeline: A Chronicle of US Intervention in Central and Latin America, the work was originally installed in New York’s PS1 Gallery in 1984, when Central America was in the spotlight of political and economic debate in the West. Fast forward thirty years and the exhibition returns to this history of intervention and its consequences, through the work of contemporary artists who chronicle related historical episodes, accounts and phenomena. Two of the films found in this display refer back to U.S. colonialism in Panama and more specifically to the building of the Panama Canal. Humberto Vélez focuses on the metaphor of the subjected human body and the representation of power and strength over a nation, while Michael Stevenson considers the complex relationship sustained between the USA and Panama after the signing of the Torrijos-Carter Treaties in 1977 - which promised the handover of theCanal Zoneto the Central American country. The works of Óscar Figueroa and Andreas Siekmann separately address the existence of a mono-cultural economy based almost exclusively on the extraction of bananas and coffee and the impact that international corporations such as the United Fruit Company have had on the natural and social landscape of much of this region. The performance work of Regina José Galindo confronts the torrid history of Guatemalaand its hidden genocides. Her explorations of unequal power relations often expose the violent consequences that regularly result from political interventions.",,2451,2523,73
