19,Malevich,,Modernism,USSR,Painting,Artist,Kazmir Malevich,2014-07-16,2014-10-26,102.0,2014-15,,Paid,"Stedelijk Museum, Amsterdam and Art and Exhibition Hall of the Federal Republic of Germany, Bonn",Blavatnik Family Foundation and Amsterdam Trade Bank with additional support from R and S Cohen Foundation,http://www.tate.org.uk/whats-on/tate-modern/exhibition/malevich,"Kazimir Malevich, an artist as influential as he was radical, cast a long shadow over the history of modern art. This, his first retrospective in thirty years and the first ever in the UK, unites works from collections in Russia, the US and Europe to tell a fascinating story of revolutionary ideals and the power of art itself. Malevich (1879–1935) lived and worked through one of the most turbulent periods in twentieth century history. Having come of age in Tsarist Russia, Malevich witnessed the First World War and the October Revolution first-hand. His early experiments as a painter led him towards the invention of suprematism, a bold visual language of abstract geometric shapes and stark colours, epitomised by the Black Square. One of the defining works of Modernism, the painting was revealed to the world after months of secrecy and was hidden again for almost half a century after its creator’s death. It sits on a par with Duchamp’s ‘readymade’ as a game-changing moment in twentieth century art and continues to inspire and confound viewers to this day. Starting from his early paintings of Russian landscapes, agricultural workers and religious scenes, the exhibition follows Malevich’s journey towards abstract painting and his suprematist masterpieces, his temporary abandonment of painting in favour of teaching and writing, and his much-debated return to figurative painting in later life. Bringing together paintings, sculptures, theatre and an unprecedented collection of drawings it offers a complete view of his career, celebrating some of the most progressive art ever made. With generous loans from the Khardzhiev Collection, Amsterdam and the Costakis Collection, SMCA-Thessaloniki. The exhibition is organised by Tate Modern, in collaboration with the Stedelijk Museum, Amsterdam and Art and Exhibition Hall of the Federal Republic of Germany, Bonn.",,2526,2628,103
20,Alibis: SIgmar Polke 1963-2010,,"Post-War, Contemporary",Germany,Mixed,Artist,Sigmar Polke,2014-10-09,2015-02-08,122.0,2014-15,,Paid,Moma,Fergus McCaffrey with additional support from The Sigmar Polke Exhibition Supporters Group and Tate International Council,http://www.tate.org.uk/whats-on/tate-modern/exhibition/alibis-sigmar-polke-1963-2010,"Sigmar Polke was one of the most insatiably experimental artists of the twentieth century. This retrospective is the first to bring together the unusually broad range of media he worked with during his five-decade career – not only painting, drawing, photography, film and sculpture, but also notebooks, slide projections and photocopies. He worked in off-the-wall materials ranging from meteor dust to gold, bubble wrap, snail juice, potatoes, soot and even uranium, all the while resisting easy categorisation. Polke’s relentlessly inventive works range in size from the intimacy of a notebook to monumental paintings. He took a wildly different approach to art-making, from his responses to consumer society in the 1960s to his interest in travel, drugs and communal living in the 1970s and his increasingly experimental practice after 1980. Beneath Polke’s irreverent wit, promiscuous intelligence, and chance operations lay a deep scepticism of all authority. It would be impossible to understand this attitude, and the creativity that grew out of it, without considering Polke’s biography and its setting. In 1945, near the end of World War II, his family fled Silesia (in present-day Poland) for what would soon be Soviet-occupied East Germany, and then escaped again, this time to West Germany, in 1953. Polke grew up at a time when many Germans deflected blame for the atrocities of the Nazi period with the alibi, 'I didn’t see anything'. In various works in the exhibition, Polke opposes many Germans of his generation's tendency to ignore the Nazi past, as if picking off the scab to reopen the wound.",,2611,2733,123
21,"Conflict, Time, Photgraphy",,Mixed,Mixed,Photography,Theme,-,2014-11-26,2015-03-15,109.0,2014-15,,Free,,-,http://www.tate.org.uk/whats-on/tate-modern/exhibition/conflict-time-photography,"From the seconds after a bomb is detonated to a former scene of battle years after a war has ended, this moving exhibition focuses on the passing of time, tracing a diverse and poignant journey through over 150 years of conflict around the world, since the invention of photography. In an innovative move, the works are ordered according to how long after the event they were created from moments, days and weeks to decades later. Photographs taken seven months after the fire bombing of Dresden are shown alongside those taken seven months after the end of the First Gulf War. Images made in Vietnam 25 years after the fall of Saigon are shown alongside those made in Nakasaki 25 years after the atomic bomb. The result is the chance to make never-before-made connections while viewing the legacy of war as artists and photographers have captured it in retrospect. The immediate trauma of war can be seen in the eyes of Don McCullin’s Shell-shocked US Marine 1968, while the destruction of buildings and landscapes are documented by Simon Norfolk’s Afghanistan: Chronotopia 2001. Different conflicts will also reappear from multiple points in time throughout the exhibition. The Second World War for example is addressed in Jerzy Lewczynski’s 1960 photographs of the Wolf's Lair / Adolf Hitler's r Headquarters, Shomei Tomatsu’s images of objects found in Nagasaki, Kikuji Kawada’s epic project The Map made in Hiroshima in the 1960s, Michael Schmidt’s Berlin streetscapes from 1980 and Nick Waplington’s 1993 close-ups of cell walls from a Prisoner of War camp in Wales. The exhibition is staged to coincide with the 2014 centenary and concludes with new and recent projects by British, German, Polish and Syrian photographers which reflect on the First World War a century after it began.",,2659,2768,110
22,Richard Tuttle: I Don't Know. The Weave of Textile Language,Turbine Hall,Contemporary ,UK,Sculpture,Miniature / One off,Richard Tuttle,2014-10-14,2015-04-06,174.0,2014-15,,Free ,Whitechapel Gallery,The I Don’t Know . The Weave of Textile Language Supporters Circle,http://www.tate.org.uk/whats-on/tate-modern/exhibition/richard-tuttle-i-dont-know-weave-textile-language,"Tate Modern’s Turbine Hall has played host to some of the world’s most striking and memorable works of contemporary art. Now, this vast space welcomes the largest work ever created by renowned American sculptor Richard Tuttle (born 1941). Entitled I Don’t Know . The Weave of Textile Language, this newly commissioned sculpture combines vast swathes of fabrics designed by the artist from both man-made and natural fibres in three bold and brilliant colours. The commission is part of a wider survey of the artist taking place in London this autumn and comprising a major exhibition at the Whitechapel Gallery surveying five decades of Tuttle's career and a sumptuous new publication rooted in the artist's own collection of historic and contemporary textiles",,2616,2790,175
23,Marlene Dumas: The Image as Burden,,Contemporary ,South Africa,Painting,Artist,Marlene Dumas,2015-02-05,2015-05-10,94.0,2014-15,,Free,Stedelijk,Mondriaan Fund with additional support from The Image as Burden Exhibition Supporters Group and Tate Patron,http://www.tate.org.uk/whats-on/tate-modern/exhibition/marlene-dumas-image-burden,"Marlene Dumas is one of the most prominent painters working today. Her intense, psychologically charged works explore themes of sexuality, love, death and shame, often referencing art history, popular culture and current affairs – themes you can explore through related events. 'Secondhand images', she has said, 'can generate first-hand emotions.' Dumas never paints directly from life, yet life in all its complexity is right there on the canvas. Her subjects are drawn from both public and personal references and include her daughter and herself, as well as recognisable faces such as Amy Winehouse, Naomi Campbell, Princess Diana, even Osama bin Laden. The results are often intimate and at times controversial, where politics become erotic and portraits become political. She plays with the imagination of her viewers, their preconceptions and fears. Born in 1953 in Cape Town, South Africa, Dumas moved to the Netherlands in 1976, where she came to prominence in the mid-1980s. This large-scale survey is the most significant exhibition of her work ever to be held in Europe, charting her career from early works, through seminal paintings to new works on paper. The title of the exhibition is taken from The Image as Burden 1993, a small painting depicting one figure carrying another. As with many of Dumas's works, her choice of title deeply affects our interpretation of the work. It hints at the sense of responsibility faced by the artist in choosing to create an image that can translate ideas about painting and the position of the artist. For Dumas it is important 'to give more attention to what the painting does to the image, not only to what the image does to the painting.' In an age dominated by the digital image and mass media, Dumas cherishes the physicality of the human touch with work that is a testament to the meaning and potency of painting.",,2730,2824,95
24,Saloua Raouda Choucair,,Post-War,Lebanon,Sculpture,Artist,Saloua Raouda Choucair,2013-04-17,2013-11-17,214.0,2013-14,,Paid,,"averda, The Choucair Exhibition Supporters Group",http://www.tate.org.uk/whats-on/tate-modern/exhibition/saloua-raouda-choucair,"The world’s first major museum exhibition of Lebanese artist Saloua Raouda Choucair celebrates this remarkable artist’s extraordinary body of work. Choucair is a pioneer of abstract art in the Middle East and, born in 1916, takes her rightful position as a significant figure in the history of twentieth-century art. Through painting and drawing, architecture, textiles and jewellery, as well as, of course, her prolific and experimental sculptures, visitors can discover how Choucair worked in diverse media pursuing her interests in science, mathematics and Islamic art and poetry. Many of the works, made over a period of five decades, have not previously been seen outside of Lebanon. A rare female voice in the Beirut art scene from the 1940s onwards, Choucair’s work combines elements of western abstraction with Islamic aesthetics. It is characterised by an experimental approach to materials alongside an elegant use of modular forms, lines and curves drawn from the traditions of Islamic design. The exhibition focuses on Choucair’s sculptures from the 1950s to the 1980s, created in wood, metal, stone and fibreglass, as well as extensive examples of her early abstract paintings and some key figurative works such as Self-Portrait 1943 and Paris-Beirut 1948.",,2071,2285,215
25,Ellen Gallagher: AxME,,Contemporary,USA,Sculpture,Artist,Ellen Gallagher,2013-05-01,2013-09-01,123.0,2013-14,,Paid,,"Glenn and Amanda Fuhrman, The Ellen Gallagher Supporters Group, Tate Patrons and Tate International Council",http://www.tate.org.uk/whats-on/tate-modern/exhibition/ellen-gallagher-axme,"Ellen Gallagher is one of the most acclaimed contemporary artists to have emerged from North America since the mid-1990s. Her gorgeously intricate and highly imaginative works are realised with a wealth of virtuoso detail and wit. This is her first major solo exhibition in the UK, providing the first ever opportunity to explore an overview of her twenty-year career. Gallagher brings together imagery from myth, nature, art and social history to create complex works in a wide variety of media including painting, drawing, relief, collage, print, sculpture, film and animation. The exhibition explores the themes which have emerged and recurred in her practice, from her seminal early canvases through to recent film installations and new bodies of work. In her series of wig-map grid collages, Double Natural, POMP-BANG, and eXelento, Gallagher has appropriated and incorporated found advertisements for hair and beauty products from the 1930s to the late 1970s from publications such as Ebony, Our World and Black Stars. These advertisements fostered ideals in black beauty through wigs and hair adornments, which Gallagher has then recontextualised, collaging the Afro wig elements and embellishing them with plasticine. As she comments: ‘The wig ladies are fugitives, conscripts from another time and place, liberated from the “race” magazines of the past. But again, I have transformed them, here on the pages that once held them captive.’ The exhibition includes other such key works as Bird in Hand 2006, a complex relief built up in layers of printed matter, plasticine, crystal, paint, gold leaf and salt. In Bird in Hand, human life and marine life converge at the bottom of the ocean in a mythical black Atlantis. Gallagher’s mysterious vision of marine life extends beyond the canvas and into other media, such as the 16 mm film installation Murmur 2003–4 (a collaboration with Edgar Cleijne), as well as the ongoing series of delicate watercolours and cut paper works entitled Watery Ecstatic. New and recent work on display for the first time at Tate Modern include Morphia, a series of two-sided drawings, which show how Gallagher combines the intimate with the epic, the urban with the oceanic, the ethereal with the physical and history with the present. Ellen Gallagher was born in Providence, Rhode Island in 1965 and now lives and works in Rotterdam and New York. Her work is held in many major public collections, including MoMA and Metropolitan Museum of Art in New York and Centre Pompidou, Paris.",,2085,2208,124
26,Ibrahim El-Salahi: A Visionary Modernist,,Post-War,Sudan,Painting,Artist,Ibrahim El-Salahi,2013-07-03,2013-09-22,81.0,2013-14,,Paid,"Sharjah Art Museum in May 2012 and travelled to the Katara Cultural Village Foundation, Doha, Qata",Guaranty Trust Bank Plc.,http://www.tate.org.uk/whats-on/tate-modern/exhibition/ibrahim-el-salahi-visionary-modernist,"The first Tate Modern exhibition dedicated to African Modernism traces the life and work of Ibrahim El-Salahi. This major retrospective brings together 100 works from across more than five decades of his international career. The exhibition highlights one of the most significant figures in African and Arab Modernism and reveals his place in the context of a broader, global art history. The exhibition outlines the artist’s personal journey, beginning in Sudan in the 1950’s and followed by his international schooling at the Slade School in London. After a period of research and self-discovery, he returned to Sudan in 1957. There, he established a new Sudanese visual vocabulary, which arose from his own pioneering integration of Islamic, African, Arab and Western artistic traditions. El-Salahi lived in Qatar before settling in England in the 1990s. His recent paintings reflect his joy for life, his deep spiritual faith, and a profound recognition of his place in the world. Ibrahim El-Salahi: A Visionary Modernist is organised by the Museum for African Art, New York, in association with Tate Modern, London. The exhibition is curated by Salah M. Hassan, Goldwin Smith Professor, Cornell University. The presentation at Tate Modern is curated in collaboration with Elvira Dyangani Ose, Curator, International Art, Supported by Guaranty Trust Bank Plc. The exhibition first opened at the Sharjah Art Museum in May 2012 and travelled to the Katara Cultural Village Foundation, Doha, Qatar in October 2012. An illustrated catalogue accompanies the exhibition, edited by Salah M Hassan with contributions by Sarah Adams, Ulli Beier, Iftikhar Dadi, Hassan Musa and Chika Okeke-Agulu, as well as special texts by El-Salahi.",,2148,2229,82
27,Meschac Gaba: Museum of Contemporary African Art 1997–2002,,Contemporary,Benin,Installation,Miniature / One off,Meschac Gaba,2013-07-03,2013-09-22,81.0,2013-14,,Free,,Guaranty Trust Bank Plc.,http://www.tate.org.uk/whats-on/tate-modern/exhibition/meschac-gaba-museum-contemporary-african-art,,,2148,2229,82
28,Project Space: Word. Sound. Power,Project Space,Contemporary,Mixed,Mixed,Mixed,-,2013-07-12,2013-11-03,114.0,2013-14,,Free,"Khoj, International Artists’ Association, New Delhi,",,http://www.tate.org.uk/whats-on/tate-modern/exhibitionseries/project-space/project-space-word-sound-power,"From a single utterance, to the pronunciation of a name and the declaration of an idea, the voice is a tool through which we assert our presence in the world. The use of the voice as a means of protest and as a metaphor for self-representation is central to this exhibition. By bringing together the work of Lawrence Abu Hamdan, Caroline Bergvall, Amar Kanwar, Nikolaj Bendix Skyum Larsen, Anjali Monteiro and K.P. Jayasankar, Pallavi Paul and Mithu Sen – including audio documentary, video, performance, text and sound – this exhibition takes a moment to listen to the harmony and dissonance of voices rising. Artist Nikolaj Bendix Skyum Larsen presents a newly commissioned work that grounds the relevance of the voice – singular and collective, celebrated and silenced – in the localities neighbouring Tate Modern in London and Khoj, International Artists’ Association in New Delhi. Larsen encounters the lives of four young men, continents apart who show deep sadness, sheer belief and aspiration as they attempt to find expression and empowerment. United through hip-hop culture dance, rap and poetry become means to raise their voices in the face of adversity.",,2157,2271,115
29,Mira Schendel,,Post-War,Brazil,Sculpture,Artist,Mira Schendel,2013-09-25,2014-01-19,116.0,2013-14,,Paid,,Itaú With additional support from the Mira Schendel Exhibition Supporters Group,http://www.tate.org.uk/whats-on/tate-modern/exhibition/mira-schendel,"Mira Schendel (1919–1988) was one of Latin America's most important and prolific post-war artists. With her contemporaries Lygia Clark and Hélio Oiticica, Schendel reinvented the language of European Modernism in Brazil. Tate Modern is staging the first ever international full-scale survey of her work. The exhibition reveals aspects of Schendel's dialogues with a diverse range of philosophers and thinkers, as well as her engagement with universal ideas of faith, self-understanding and existence. It brings together over 250 paintings, drawings and sculptures from across her entire career, including works which have never been exhibited before.",,2232,2348,117
30,The EY Exhibition: Paul Klee – Making Visible,,Modernism,Switzerland,Painting,Artist,Paul Klee,2013-10-16,2014-03-09,144.0,2013-14,,Paid,,EY Tate Arts Partnership With additional support from The Paul Klee Exhibition Supporters Group,http://www.tate.org.uk/whats-on/tate-modern/exhibition/paul-klee-making-visible,"Paul Klee is a giant of twentieth-century art and one of the great creative innovators of the time. Witty, inventive, magical, his exquisite paintings resist easy classification. He is mentioned in the same breath as Matisse, Picasso and his Bauhaus contemporary Kandinsky. He cuts a radical figure in European modernism. His influence on abstraction can be seen in the works of Rothko, Miró and beyond. And yet, for an artist of such stature, there is still so much to discover about him. At Tate Modern this autumn, you can rediscover Klee's extraordinary body of work and see it in a new light. Paintings, drawings and watercolours from collections around the world will be reunited and displayed alongside each other as the artist originally intended, often for the first time since Klee exhibited them himself. The EY Exhibition: Paul Klee – Making Visible begins with the artist’s breakthrough during the First World War, when he first developed his individual abstract patchworks of colour that later became characteristic of his ‘magic square’ paintings. The heart of the exhibition will focus on the decade Klee spent teaching and working at the Bauhaus, the hotbed of modernist design. The abstract canvases he produced there, such as the rhythmical composition Fire in the Evening 1929, took his reputation to new international heights. The 1930s then brought about radical changes. Having moved to Düsseldorf, Klee was dismissed from his new teaching position by the Nazis and took refuge in Switzerland with his family, while his works were removed from collections and labelled ‘degenerate art’ in Germany. Despite the political turmoil, financial insecurity and his declining health, he nevertheless became even more prolific. Small, expressive canvases, rich with meaning and grouped as Klee himself grouped them: seeing Paul Klee at Tate Modern is your opportunity to understand Klee’s art as he intended and to appreciate the impact of this fascinating artist. The EY Exhibition: Paul Klee presents a revelatory experience of the work of this modern master.",,2253,2397,145
31,Project Space: Inverted House,Project Space,Contemporary,"Serbia, Croatia",Installation,Miniature / One off,-,2013-11-22,2014-04-13,142.0,2013-14,,Free,"Museum of Contemporary Art, Belgrade",,http://www.tate.org.uk/whats-on/tate-modern/exhibitionseries/project-space/project-space-inverted-house,"Opening at Tate Modern on 22 November 2013, this collaborative exhibition between Tate and the Museum of Contemporary Art, Belgrade showcases the work of Tina Gverović and Siniša Ilić for their first UK museum show. Invited as part of the project to participate in a two-week residency at Tate Modern, Gverović and Ilić work collaboratively during this time to create a new site-specific installation that responds to the building, its collection and its public, focusing on the role of the museum in a wider global context. Taking the residency as a creative process for artists and curators as its starting point, the exhibition considers key questions of museum function, social interaction and the potential of collaborative conversation.",,2290,2432,143
32,Richard Hamilton,,Post-War,UK,Mixed,Artist,Richard Hamilton,2014-02-13,2014-05-26,102.0,2013-14,,Paid,,The Richard Hamilton Exhibition Supporters Group and Tate Patrons,http://www.tate.org.uk/whats-on/tate-modern/exhibition/richard-hamilton,"One of the most influential British artists of the 20th century, Richard Hamilton (1922–2011) is widely regarded as a founding figure of pop art, who continued to experiment and innovate over a career of 60 years. Tate Modern presents the first retrospective to encompass the full scope of Hamilton’s work, from his early exhibition designs of the 1950s to his final paintings of 2011. This exhibition explores his relationship to design, painting, photography and television, as well as his engagement and collaborations with other artists. Hamilton is best known for his pivotal role in the birth of pop art, including the groundbreaking installation Fun House 1956. A centrepiece of the exhibition, this immersive room combines images from movie-posters, magazines and art history, and will be shown alongside a print of the era-defining Just what is it that makes today’s homes so different, so appealing?. The depiction of Mick Jagger in the iconic series Swingeing London 67 1968–9, as well as images of other celebrities such as Bing Crosby and Marilyn Monroe, will show Hamilton’s continued interest in popular culture. Wider contemporary issues and political subjects are also addressed in his work, including the Kent State shootings and the IRA ‘dirty protests’, as well as figures like Margaret Thatcher and Tony Blair in such works as Treatment Room 1984 and Shock and Awe 2010. Hamilton’s interest in interiors, architecture and design is represented by his depictions of everything from the Guggenheim Museum in New York to a classic Braun toaster.",,2373,2475,103
33,Damien Hirst,,Contemporary,UK,Sculpture,Artist,Damien Hirst,2012-04-04,2012-09-09,158.0,2012-13,463087,Paid,,Qatar Museums Authority,http://www.tate.org.uk/whats-on/tate-modern/exhibition/damien-hirst,"Damien Hirst first came to public attention in London in 1988 when he conceived and curated Freeze, an exhibition in a disused warehouse which showed his work and that of his friends and fellow students at Goldsmiths College. In the nearly quarter of a century since that pivotal show, Hirst has become one of the most influential artists of his generation. This is the first substantial survey of his work in a British institution and brings together key works from over twenty years. The exhibition includes iconic sculptures from his Natural History series, including The Physical Impossibility of Death in the Mind of Someone Living 1991, in which he suspended a shark in formaldehyde. Also included are vitrines such as A Thousand Years from 1990, medicine cabinets, pill cabinets and instrument cabinets in addition to seminal paintings made throughout his career using butterflies and flies as well as spots and spins. The two-part installation In and Out of Love, not shown in its entirety since its creation in 1991 and Pharmacy 1992 are among the highlights of the exhibition.",,1693,1851,159
